{
  "$schema": "./schemas/assessment.schema.json",
  "schemaVersion": 1,
  "reviewedAt": "2026-09-15",
  "statusDefinitions": {
    "implemented": "Present, production-reachable, and backed by named verification evidence.",
    "partial": "Present but has a documented boundary, structural risk, or incomplete verification.",
    "planned": "Desired in the target architecture but not implemented.",
    "accepted_exception": "A deliberate divergence from the target pattern with a recorded reason and guard.",
    "deprecated": "Present only for migration or compatibility and should lose callers.",
    "unknown": "Not yet reviewed with enough evidence to classify."
  },
  "components": [
    {
      "component": "core",
      "implementationStatus": "implemented",
      "evidence": [
        "Excise.Core.Tests",
        "scripts/check-reachability.sh --quiet",
        "scripts/check-unwired-api.sh --assembly Excise.Core --quiet"
      ],
      "gaps": [
        "The public library surface is intentionally broad and still needs periodic production-reachability triage."
      ],
      "issueIds": [
        921
      ]
    },
    {
      "component": "core-primitives",
      "implementationStatus": "implemented",
      "evidence": [
        "Excise.Core.Tests/Primitives"
      ],
      "gaps": [],
      "issueIds": []
    },
    {
      "component": "core-parsing",
      "implementationStatus": "implemented",
      "evidence": [
        "Excise.Core.Tests/Parsing",
        "Excise.Core.Tests/Filters",
        "Excise.Core.Tests/Parsing/StructureAwareFuzzTests.cs"
      ],
      "gaps": [
        "Long-run resource budgets and reproducible minimized fuzz-corpus handling remain active work."
      ],
      "issueIds": [
        1232
      ]
    },
    {
      "component": "core-document",
      "implementationStatus": "implemented",
      "evidence": [
        "Excise.Core.Tests/Document",
        "Excise.Core.Tests/Editing",
        "Excise.Core.Tests/Operations",
        "Excise.Core/Content/PdfPageContentFacade.cs",
        "Excise.Core/Document/PdfDocumentDerivedState.cs",
        "Excise.Core/Document/PdfDocumentOpenPipeline.cs",
        "Excise.Core/Document/PdfDocumentObjectStore.cs",
        "Excise.Core/Text/PdfPageTextFacade.cs",
        "Excise.Core/Text/PdfDocumentTextFacade.cs",
        "Excise.Core/Writing/PdfDocumentSaveLifecycle.cs",
        "Excise.Core/Writing/PdfDocumentWritingFacade.cs"
      ],
      "gaps": [],
      "issueIds": []
    },
    {
      "component": "core-content",
      "implementationStatus": "implemented",
      "evidence": [
        "Excise.Core.Tests/Content",
        "Excise.Core.Tests/Text/TextMatrixLineSteppingTests.cs"
      ],
      "gaps": [
        "The renderer necessarily re-executes graphics/text state as an accepted exception. Shared glyph/CMap decoding is font-owned, and canonical PDF numeric token formatting is primitive-owned."
      ],
      "issueIds": [
        980,
        986,
        992
      ]
    },
    {
      "component": "core-fonts",
      "implementationStatus": "partial",
      "evidence": [
        "Excise.Core.Tests/Fonts",
        "Excise.Core.Tests/Text"
      ],
      "gaps": [
        "Full PDF font-model completeness and provenance coverage remain broader than the currently supported corpus; shared glyph/CMap decoders and lookup tables are now font-owned."
      ],
      "issueIds": [
        1242,
        1265
      ]
    },
    {
      "component": "core-text",
      "implementationStatus": "implemented",
      "evidence": [
        "Excise.Core.Tests/Text",
        "scripts/check-extraction-parity.sh"
      ],
      "gaps": [
        "Extraction coverage remains a measured bound on text redaction completeness, not a proof of completeness."
      ],
      "issueIds": []
    },
    {
      "component": "core-redaction",
      "implementationStatus": "partial",
      "evidence": [
        "scripts/verify-true-redaction.sh",
        "scripts/check-redaction-oracles.sh",
        "Excise.Core.Tests/Text/Segmentation",
        "Excise.Core/Redaction/RedactedCopySafetyContract.cs",
        "Excise.Core/Redaction/RedactedCopySafetyPolicy.cs",
        "Excise.Core.Tests/Text/Segmentation/RedactedCopySafetyPolicyTests.cs",
        "Excise.Rendering.Tests/Differential/RedactionReferenceVerificationTests.cs"
      ],
      "gaps": [
        "Sixty-seven method-level redaction assertions still carry reviewed exceptions; generic no-independent-oracle entries remain an assurance backlog."
      ],
      "issueIds": [
        1029,
        1077,
        1291
      ]
    },
    {
      "component": "core-encryption",
      "implementationStatus": "implemented",
      "evidence": [
        "Excise.Core/Encryption",
        "Excise.Core.Tests/Security",
        "Excise.Core.Tests/Writing/PdfDocumentWriterEncryptionTests.cs",
        "Excise.Rendering.Tests/Differential/EncryptionWriterInteropTests.cs",
        "Excise.Rendering.Tests/Differential/EncryptionPreservationInteropTests.cs"
      ],
      "gaps": [],
      "issueIds": []
    },
    {
      "component": "core-writing",
      "implementationStatus": "implemented",
      "evidence": [
        "Excise.Core.Tests/Writing",
        "Excise.Core.Tests/Conformance"
      ],
      "gaps": [],
      "issueIds": []
    },
    {
      "component": "core-security",
      "implementationStatus": "partial",
      "evidence": [
        "Excise.Core.Tests/Validation",
        "Excise.App.Tests/Unit/SignatureVerificationServiceTests.cs"
      ],
      "gaps": [
        "Platform signature trust behavior remains at delivery-layer action boundaries by design; structural and conformance validation remains distinct from platform trust evaluation."
      ],
      "issueIds": []
    },
    {
      "component": "rendering",
      "implementationStatus": "partial",
      "evidence": [
        "Excise.Rendering.Tests",
        "Excise.Rendering.Tests/Differential",
        "Excise.Rendering/RenderResourceScope.cs",
        "Excise.Rendering.Tests/RenderResourceScopeTests.cs",
        "Excise.Rendering/EncodedImageDecoder.cs",
        "Excise.Rendering/RawSampleImageDecoder.cs",
        "Excise.Rendering/DctImageDecoder.cs",
        "Excise.Rendering/JpxImageDecoder.cs",
        "Excise.Rendering/ContentOperatorRoute.cs",
        "Excise.Rendering/SkiaRenderer.Operators.cs",
        "Excise.Rendering/AnnotationAppearancePolicy.cs",
        "Excise.Rendering/AnnotationAppearanceExecution.cs",
        "Excise.Rendering/AcroFormAppearanceDefaults.cs",
        "Excise.Rendering/Transparency/DeviceCmykExecutionState.cs",
        "Excise.Rendering/Transparency/DeviceCmykBackdrop.cs",
        "Excise.Rendering.Tests/EncodedImageDecoderTests.cs",
        "Excise.Rendering.Tests/RawSampleImageDecoderTests.cs",
        "Excise.Rendering.Tests/DctImageDecoderTests.cs",
        "Excise.Rendering.Tests/JpxImageDecoderTests.cs",
        "Excise.Rendering.Tests/ContentOperatorRouteTests.cs",
        "Excise.Rendering.Tests/AnnotationAppearancePolicyTests.cs",
        "Excise.Rendering.Tests/AnnotationAppearanceExecutionTests.cs",
        "Excise.Rendering.Tests/AcroFormAppearanceDefaultsTests.cs",
        "Excise.Rendering.Tests/DeviceCmykExecutionStateTests.cs",
        "Excise.App/Services/PageImageRenderer.cs",
        "scripts/run-exploratory-corpus.sh"
      ],
      "gaps": [
        "A facade-owned per-page resource scope gives nested render contexts one explicit cache lifetime; typed context-free raw, encoded, DCT, and JPX decoders own image sample and codec policy; and one allocation-free operator registry routes the single interpreter through reviewed family handlers with ordered cancellation, marked-content, optional-content, and Type 3 preconditions. Annotation visibility, appearance selection, synthesis routing, and geometry planning are canvas-free; one typed execution request enters the existing Form XObject/operator pipeline; and AcroForm defaults have one explicit lazy owner. One Skia-specific DeviceCMYK execution-state owner controls group and backdrop lifetime, typed child-group entry and completion, RGB dirty synchronization, and scratch-mask disposal without duplicating the pixel algorithms or Core color-space semantics. Rendering re-executes graphics/text state as an accepted architectural exception."
      ],
      "issueIds": [
        1262,
        1293,
        1329,
        1330,
        1331,
        1332
      ]
    },
    {
      "component": "ocr-native",
      "implementationStatus": "implemented",
      "evidence": [
        "Excise.Ocr.Tests",
        "Excise.Ocr.Native/NativeOcrEngine.cs"
      ],
      "gaps": [],
      "issueIds": []
    },
    {
      "component": "native-abi",
      "implementationStatus": "implemented",
      "evidence": [
        "Excise.Native/tests/api_test.c",
        "Excise.Native/tests/test_ctypes.py"
      ],
      "gaps": [],
      "issueIds": []
    },
    {
      "component": "ocr",
      "implementationStatus": "implemented",
      "evidence": [
        "Excise.Ocr.Tests",
        "Excise.App.Tests/Unit/MakeSearchableDialogViewModelTests.cs"
      ],
      "gaps": [],
      "issueIds": []
    },
    {
      "component": "avalonia",
      "implementationStatus": "partial",
      "evidence": [
        "Excise.Avalonia.Tests",
        "Excise.App.Tests/UI",
        "Excise.Avalonia/Controls/SinglePageRenderLifetime.cs",
        "Excise.Avalonia/Controls/PdfViewerControl.CacheGovernance.cs",
        "Excise.Avalonia.Tests/SinglePageRenderLifetimeTests.cs"
      ],
      "gaps": [
        "PdfViewerControl remains a large partial-class family after single-page render generation, cancellation-source, and bitmap-LRU lifetime moved to SinglePageRenderLifetime. Single-page and continuous caches now have disjoint documented ownership and typed telemetry, while continuous scheduling, layout, interaction, and accessibility boundaries still need measured decomposition."
      ],